{
  "schema_version": 1,
  "template_kind": "fixed_reference",
  "id": "binomial_at_least_three_defects",
  "version": 1,
  "status": "active",
  "family_id": "binomial_pmf",
  "rule_version": 1,
  "module_id": "module_2",
  "title": "Binomial cumulative tail probability for manufacturing defect batch",
  "scenario_markdown": "An electronics manufacturing line produces batches of $n = 12$ high-precision sensors. The defect probability for each sensor is $p = 0.15$, and sensor failures occur independently. Quality assurance protocol triggers a full calibration audit if a batch contains at least $3$ defective sensors ($X \\ge 3$). Determine the probability $P(X \\ge 3)$ that a randomly inspected batch triggers an audit.",
  "parameters": {
    "n": 12,
    "p": 0.15,
    "k": 3
  },
  "assumptions": [
    "Fixed sample size of n = 12 independent sensor trials",
    "Constant defect probability p = 0.15 per sensor",
    "Each sensor is classified as defective or conforming (binary outcome)",
    "Complement identity: P(X >= 3) = 1 - P(X <= 2)"
  ],
  "concept_ids": [
    "binomial_cumulative_complement_setup",
    "binomial_cumulative_lower_summation",
    "binomial_tail_probability_calculation"
  ],
  "setting_group": "electronics_sensor_batch_defect_audit",
  "source_refs": [
    "Course Module 2: Discrete Random Variables & Probability Distributions",
    "docs/COURSE-MAP.md"
  ],
  "approval": {
    "reviewer": "assistant_delegated",
    "reviewed_at": "2026-10-11T22:00:00Z",
    "notes": "Reviewed derivation: n = 12, p = 0.15. P(X=0) = 0.14224, P(X=1) = 0.30122, P(X=2) = 0.29236. Cumulative P(X<=2) = 0.73582. Upper tail P(X>=3) = 1 - 0.73582 = 0.26418 (26.42%). Excel: =1 - BINOM.DIST(2, 12, 0.15, TRUE). Distractor tests off-by-one boundary error 1 - P(X<=3).",
    "delegation_basis": "Stage 20 roadmap authorization"
  },
  "stages": [
    {
      "id": "complement_setup",
      "kind": "choice",
      "prompt_markdown": "Which complement relationship correctly sets up the cumulative tail probability $P(X \\ge 3)$?",
      "options": [
        {
          "id": "setup_correct",
          "text_markdown": "$P(X \\ge 3) = 1 - P(X \\le 2) = 1 - [P(X = 0) + P(X = 1) + P(X = 2)]$",
          "misconception_id": null,
          "hint_markdown": null
        },
        {
          "id": "setup_off_by_one",
          "text_markdown": "$P(X \\ge 3) = 1 - P(X \\le 3) = 1 - [P(X = 0) + P(X = 1) + P(X = 2) + P(X = 3)]$",
          "misconception_id": "off_by_one_discrete_tail_boundary_error",
          "hint_markdown": "Because $X = 3$ satisfies the condition 'at least 3', it must not be subtracted away. Subtract only outcomes less than 3 ($X \\le 2$)."
        },
        {
          "id": "setup_single_point",
          "text_markdown": "$P(X \\ge 3) = 1 - P(X = 3)$",
          "misconception_id": "confused_cumulative_tail_with_single_point_pmf",
          "hint_markdown": "'At least 3' includes $3, 4, 5, \\dots, 12$; its complement is $0, 1,$ and $2$, not just the point $X = 3$."
        }
      ],
      "expected_answer": {
        "kind": "choice",
        "option_id": "setup_correct"
      },
      "evidence_concept_ids": [
        "binomial_cumulative_complement_setup"
      ],
      "explanation_markdown": "In discrete distributions, boundary points matter critically. The event $X \\ge 3$ comprises outcomes $\\{3, 4, 5, \\dots, 12\\}$. The complementary outcomes are $\\{0, 1, 2\\}$, which corresponds to the cumulative probability $P(X \\le 2)$. Therefore, $P(X \\ge 3) = 1 - P(X \\le 2)$.",
      "numeric_policy": null
    },
    {
      "id": "cumulative_lower_calc",
      "kind": "choice",
      "prompt_markdown": "Calculate the cumulative probability of finding at most $2$ defective sensors: $P(X \\le 2) = P(0) + P(1) + P(2)$.",
      "options": [
        {
          "id": "lower_sum_correct",
          "text_markdown": "$P(X \\le 2) = 0.7358$ ($73.58\\%$), calculated as $0.1422 + 0.3012 + 0.2924$",
          "misconception_id": null,
          "hint_markdown": null
        },
        {
          "id": "lower_sum_point_two",
          "text_markdown": "$P(X \\le 2) = 0.2924$ ($29.24\\%$), the probability of exactly $2$ defects",
          "misconception_id": "reported_point_probability_instead_of_cumulative_sum",
          "hint_markdown": "Cumulative probability $P(X \\le 2)$ requires adding $P(0) + P(1) + P(2)$, not just $P(2)$."
        },
        {
          "id": "lower_sum_linear_rate",
          "text_markdown": "$P(X \\le 2) = 2 \\times 0.15 = 0.3000$",
          "misconception_id": "multiplied_k_by_probability_linearly",
          "hint_markdown": "Probabilities must be computed using the Binomial PMF $\\binom{n}{k}p^k(1-p)^{n-k}$, not linear scaling."
        }
      ],
      "expected_answer": {
        "kind": "choice",
        "option_id": "lower_sum_correct"
      },
      "evidence_concept_ids": [
        "binomial_cumulative_lower_summation"
      ],
      "explanation_markdown": "Compute the individual probabilities:\n- $P(0) = \\binom{12}{0}(0.15)^0(0.85)^{12} = 1(1)(0.14224) \\approx 0.14224$\n- $P(1) = \\binom{12}{1}(0.15)^1(0.85)^{11} = 12(0.15)(0.16734) \\approx 0.30122$\n- $P(2) = \\binom{12}{2}(0.15)^2(0.85)^{10} = 66(0.0225)(0.19687) \\approx 0.29236$\nSum: $P(X \\le 2) = 0.14224 + 0.30122 + 0.29236 = 0.73582$ ($73.58\\%$). In Excel: `=BINOM.DIST(2, 12, 0.15, TRUE)`.",
      "numeric_policy": null
    },
    {
      "id": "tail_calc",
      "kind": "choice",
      "prompt_markdown": "Calculate the audit trigger probability $P(X \\ge 3) = 1 - P(X \\le 2)$ and identify the matching Excel formula.",
      "options": [
        {
          "id": "tail_correct",
          "text_markdown": "$P(X \\ge 3) = 0.2642$ ($26.42\\%$), computed as `=1 - BINOM.DIST(2, 12, 0.15, TRUE)`",
          "misconception_id": null,
          "hint_markdown": null
        },
        {
          "id": "tail_off_by_one_result",
          "text_markdown": "$P(X \\ge 3) = 0.0922$ ($9.22\\%$), computed as `=1 - BINOM.DIST(3, 12, 0.15, TRUE)`",
          "misconception_id": "used_three_in_binom_dist_cumulative_subtraction",
          "hint_markdown": "Entering 3 into BINOM.DIST subtracts $P(X = 3)$, which erroneously computes $P(X \\ge 4)$."
        },
        {
          "id": "tail_exact_three",
          "text_markdown": "$P(X \\ge 3) = 0.1720$ ($17.20\\%$), computed as `=BINOM.DIST(3, 12, 0.15, FALSE)`",
          "misconception_id": "computed_exact_point_p_instead_of_tail",
          "hint_markdown": "$0.1720$ is the probability of exactly $3$ defects ($P(X = 3)$), not at least $3$ defects ($P(X \\ge 3)$)."
        }
      ],
      "expected_answer": {
        "kind": "choice",
        "option_id": "tail_correct"
      },
      "evidence_concept_ids": [
        "binomial_tail_probability_calculation"
      ],
      "explanation_markdown": "Subtracting the lower cumulative probability from $1$ yields $P(X \\ge 3) = 1 - 0.73582 = 0.26418$, or approximately $0.2642$ ($26.42\\%$). There is roughly a $26.4\\%$ probability that an audit will be triggered. In Excel: `=1 - BINOM.DIST(2, 12, 0.15, TRUE)`.",
      "numeric_policy": null
    }
  ]
}
